{
  "event_id": "e1111111-2222-4333-8444-555555555555",
  "event_type": "world.mutation_committed",
  "event_version": "1.0.0",
  "occurred_at": "2026-07-20T12:00:00Z",
  "request_id": "a1b2c3d4-e5f6-4789-a012-3456789abcde",
  "space_id": "home_01",
  "world_revision": 8,
  "actor_id": "player_001",
  "payload": {
    "receipt_id": "c0ffee00-1111-4222-8333-444444444444",
    "entity_ids": ["ent_house_01"],
    "old_world_revision": 7,
    "new_world_revision": 8
  },
  "trace_id": "trace-g1-002-commit-req"
}
